{
  "scenario_id": "thermal_power_boiler",
  "scenario_name": "火电燃煤锅炉",
  "industry": "电力",
  "process_unit": "亚临界/超临界燃煤锅炉",
  "version": "1.0.0",
  "dictionary": "fields.csv",
  "keywords": ["电厂", "火电", "锅炉", "煤粉", "汽包", "主蒸汽", "boiler", "steam"],
  "sampling_seconds": 30,
  "timestamp_field": "timestamp",
  "primary_output": "main_steam_temperature",
  "notes": "用于锅炉运行时序数据的字段需求判定与统一。"
}
