{
  "scenario_id": "cement_rotary_kiln",
  "scenario_name": "水泥回转窑",
  "industry": "建材",
  "process_unit": "新型干法水泥回转窑",
  "version": "1.0.0",
  "dictionary": "fields.csv",
  "keywords": ["水泥", "回转窑", "熟料", "分解炉", "预热器", "kiln", "clinker", "cement"],
  "sampling_seconds": 60,
  "timestamp_field": "timestamp",
  "primary_output": "clinker_free_lime",
  "notes": "用于水泥熟料烧成系统的字段需求判定与统一。"
}
