{
  "scenario_id": "steel_reheating_furnace",
  "scenario_name": "钢厂步进梁式加热炉",
  "industry": "冶金",
  "process_unit": "步进梁式加热炉",
  "version": "1.0.0",
  "dictionary": "fields.csv",
  "keywords": ["钢厂", "冶金", "加热炉", "步进梁", "钢坯", "板坯", "reheating furnace", "walking beam"],
  "sampling_seconds": 60,
  "timestamp_field": "timestamp",
  "primary_output": "slab_discharge_temp",
  "notes": "2号任务重点场景模板。字段范围用于标准校验，不执行异常清洗。"
}
